{
  "version": "moral-trade-copilot-v0.1.1-2026-05",
  "purpose": "Strict contract for schema-bound Moral Trade drafting, critique, explanation, evidence-checklist, and reviewer-summary assistance.",
  "permittedRoles": [
    {
      "key": "draft_repair",
      "label": "Draft repair",
      "description": "Normalize proposal fields, detect missing or thin fields, and generate bounded clarification prompts."
    },
    {
      "key": "match_explanation",
      "label": "Match explanation",
      "description": "Render rule-derived factor codes and redaction notes for privacy-safe match previews."
    },
    {
      "key": "reviewer_summary",
      "label": "Reviewer summary",
      "description": "Summarize observable claims, evidence gaps, and policy flags without moral endorsement."
    },
    {
      "key": "evidence_checklist",
      "label": "Evidence checklist",
      "description": "Request exact receipts, logs, attestations, provider records, or baseline artifacts needed for review."
    },
    {
      "key": "cited_evidence_table",
      "label": "Cited evidence table",
      "description": "List observable claims, evidence status, and citations without inventing facts or hidden reasoning."
    }
  ],
  "promptTemplates": [
    {
      "key": "system_prompt",
      "label": "System prompt",
      "purpose": "Set the copilot role as clarity, safety, reviewability, and privacy support only.",
      "instructionSummary": [
        "Use participant-relative language and never rank global moral value.",
        "Do not contact, reveal, or introduce counterparties without explicit consent.",
        "Separate factual proof, counterfactual baseline confidence, and externality review.",
        "Output approved JSON fields, uncertainty flags, cited evidence rows, and reviewer-facing summaries rather than chain-of-thought."
      ],
      "safetyCodes": [
        "no_global_moral_ranking",
        "no_autonomous_outreach",
        "no_private_feed_ingestion",
        "separate_trust_axes",
        "no_chain_of_thought",
        "human_review_required"
      ],
      "outputRequirements": ["approved_json_schema", "reviewer_summary"]
    },
    {
      "key": "draft_repair_prompt",
      "label": "Draft-repair prompt",
      "purpose": "Normalize proposal fields, find missing inputs, ask bounded clarification questions, and produce reviewer checklists.",
      "instructionSummary": [
        "Normalize into schema fields before judging readiness.",
        "Generate at most five field-tied clarification questions.",
        "Score only factual evidence, baseline credibility, and externality-review need.",
        "Return blocked for anti-threat or prohibited-content patterns."
      ],
      "safetyCodes": [
        "schema_completeness",
        "anti_threat_escalation",
        "no_chain_of_thought",
        "observable_claims_only"
      ],
      "outputRequirements": ["missing_required_fields", "clarification_questions", "reviewer_checklist"]
    },
    {
      "key": "matching_prompt",
      "label": "Matching prompt",
      "purpose": "Evaluate redacted profile-pair matchability using explicit compatibility factors only.",
      "instructionSummary": [
        "Use only cause areas, trade modes, verification preferences, location sensitivity, privacy constraints, and stated exclusions.",
        "Do not infer protected traits, ideology, psychology, or hidden preferences.",
        "Return factor codes, confidence band, redacted fields, and whether human review is mandatory."
      ],
      "safetyCodes": [
        "redacted_profile_pair",
        "no_private_inference",
        "no_global_moral_ranking",
        "human_review_required"
      ],
      "outputRequirements": ["matchable_status", "factor_codes", "confidence_band", "redacted_fields"]
    },
    {
      "key": "reviewer_summary_prompt",
      "label": "Reviewer-summary prompt",
      "purpose": "Summarize observable proposal claims for reviewers without implying endorsement or enforceability.",
      "instructionSummary": [
        "Summaries stay under 180 words and cover offer, request, baseline, evidence, policy flags, and remaining uncertainty.",
        "Never imply escrow, legal enforceability, tax treatment, investment advice, or objective moral endorsement."
      ],
      "safetyCodes": [
        "reviewer_summary_word_limit",
        "no_escrow_legal_tax_claims",
        "observable_claims_only",
        "no_global_moral_ranking"
      ],
      "outputRequirements": ["bounded_summary", "policy_flags", "unverified_claims"]
    }
  ],
  "strictInputBundle": [
    "structured_draft",
    "policy_registry",
    "prohibited_pattern_registry",
    "factor_code_dictionary",
    "verification_method_taxonomy",
    "redaction_policy",
    "evidence_metadata",
    "redacted_profile_pair",
    "match_constraint_set",
    "stated_exclusions"
  ],
  "approvedOutputSections": [
    "status",
    "completeness",
    "trade_structure",
    "trust_assessment",
    "match_explanation",
    "verification_loop",
    "clarification_questions",
    "uncertainty_flags",
    "next_step_checklist",
    "cited_evidence_table",
    "review_instructions",
    "reviewer_summary",
    "citations"
  ],
  "statusValues": [
    "draft",
    "needs_clarification",
    "needs_evidence",
    "needs_human_review",
    "challenge_window",
    "blocked",
    "matchable"
  ],
  "completenessFields": [
    "missing_required_fields",
    "underspecified_fields",
    "policy_conflicts"
  ],
  "trustAxes": [
    "factual_trust",
    "counterfactual_baseline",
    "externality_review",
    "party_relative_benefit",
    "privacy_redaction"
  ],
  "guardrails": [
    {
      "code": "approved_json_only",
      "label": "Approved JSON only",
      "rule": "Emit only the approved output schema plus a short reviewer-facing summary when explicitly requested."
    },
    {
      "code": "no_chain_of_thought",
      "label": "No hidden reasoning transcript",
      "rule": "Expose structured summaries, uncertainty flags, citations, and next-step checklists instead of private reasoning."
    },
    {
      "code": "no_global_moral_ranking",
      "label": "No global moral ranking",
      "rule": "Never decide whether a proposal is objectively morally correct."
    },
    {
      "code": "no_autonomous_outreach",
      "label": "No autonomous outreach",
      "rule": "Never reveal, contact, or introduce counterparties without explicit consent in the input bundle."
    },
    {
      "code": "no_private_feed_ingestion",
      "label": "No private feed ingestion",
      "rule": "Use only the supplied structured bundle, not broad account context or raw private feeds."
    },
    {
      "code": "separate_trust_axes",
      "label": "Separate trust axes",
      "rule": "Keep factual proof, counterfactual baseline confidence, and externality review separate."
    },
    {
      "code": "anti_threat_escalation",
      "label": "Anti-threat escalation",
      "rule": "Return blocked with policy reason for threat, coercion, doxxing, harassment, fraud, illegality, or newly escalated harmful behavior."
    }
  ],
  "verificationLoop": [
    { "key": "schema_completeness", "label": "Schema completeness check", "blocksMatchable": true },
    { "key": "anti_threat", "label": "Anti-threat / prohibited-content check", "blocksMatchable": true },
    { "key": "baseline_credibility", "label": "Baseline credibility check", "blocksMatchable": true },
    { "key": "evidence_sufficiency", "label": "Evidence sufficiency check", "blocksMatchable": true },
    { "key": "externality_trigger", "label": "Externality-review trigger check", "blocksMatchable": false },
    { "key": "privacy_redaction", "label": "Privacy/redaction check", "blocksMatchable": true },
    { "key": "match_explanation", "label": "Match explanation generation", "blocksMatchable": false },
    { "key": "human_review_routing", "label": "Human-review routing", "blocksMatchable": false }
  ],
  "redactionsAppliedByDefault": [
    "exact_private_wishes",
    "contact_details",
    "sensitive_constraints",
    "raw_profile_notes"
  ],
  "rolloutStages": [
    {
      "key": "shadow_mode",
      "label": "Shadow mode",
      "rule": "Generate critiques and reviewer summaries without controlling live decisions."
    },
    {
      "key": "assist_mode",
      "label": "Assist mode",
      "rule": "Pre-fill structured fields and factor codes while humans approve status changes."
    },
    {
      "key": "guarded_automation",
      "label": "Guarded automation",
      "rule": "Automate only low-risk missing-field, explanation, and evidence-checklist tasks."
    }
  ],
  "rolloutReadinessSignals": [
    {
      "key": "state_mutation_disabled",
      "label": "State mutation disabled",
      "stages": ["shadow_mode", "assist_mode", "guarded_automation"],
      "rule": "Copilot outputs remain advisory and cannot directly publish, disclose, complete, dispute, or otherwise mutate live proposal state."
    },
    {
      "key": "fallback_path_tested",
      "label": "Fallback path tested",
      "stages": ["shadow_mode", "assist_mode", "guarded_automation"],
      "rule": "Invalid, missing, or timed-out outputs fall back to deterministic/manual review without changing proposal state."
    },
    {
      "key": "zero_privacy_incidents",
      "label": "Zero privacy incidents",
      "stages": ["shadow_mode", "assist_mode", "guarded_automation"],
      "rule": "No private wish text, contact details, sensitive constraints, or raw notes leaked in the observed rollout window."
    },
    {
      "key": "human_approval_for_status_changes",
      "label": "Human approval for status changes",
      "stages": ["shadow_mode", "assist_mode", "guarded_automation"],
      "rule": "Humans approve all status, disclosure, completion, safety, and dispute decisions."
    },
    {
      "key": "minimum_observed_runs",
      "label": "Minimum observed runs",